anibbisanta	s		prp		na + nibbisati	neg		trans	+acc	not understanding; not penetrating; not finding; lit. not going deeply (into)			√vis 1 a (to enter)	√vis + a > visa > bisa	na + ni + bisa + nta	na + niviś	√viś										DHP 153	jarāvaggo	aneka-jātisaṃsāraṃ, sandhāvissaṃ <b>anibbisaṃ</b>, <br/>gahakāraṃ gavesanto, dukkhā jāti punappunaṃ.	Buddha-paṭhama-bhāsita	The Buddha’s First Exclamation	Verses							06n	anibbis	anta prp	5			
aniyata	ps		adj	pp	na + niyameti	neg				uncertain; indefinite; not settled; lit. uncontrolled			√yam 1 a (to control, strive, end)		na + ni + √yam + ta	aniyata	√yam				VIN PAT AN	aniyatuddeso	ime kho pan'āyasmanto, dve <b>aniyatā</b> dhammā uddesaṃ āgacchanti.				DHPa 2.13.7	pesakāradhītāvatthu	addhuvaṃ me jīvitaṃ, dhuvaṃ me maraṇaṃ, avassaṃ mayā maritabbaṃ, maraṇa-pariyosānaṃ me jīvitaṃ, jīvitaṃ me <b>aniyataṃ</b> ; maraṇaṃ me niyataṃ	Anicc’ānussati	Recollection of Impermanence	Reflections							36n	aniyat	a adj	5			
anīgha	ps		adj	comp		neg				untroubled; undisturbed; calm; lit. not trembling					na + īgha	na + ṛghā					AN 4.41	samādhibhāvanāsuttaṃ	“saṅkhāya lokasmiṃ paro’parāni, yass’iñjitaṃ n’atthi kuhiñci loke. santo vidhūmo <b>anīgho</b> nirāso, atāri so jātijaran’ti brūmī”ti				Thai		ahaṃ sukhito homi niddukkho homi avero homi abyāpajjho homi <b>anīgho</b> homi sukhī attānaṃ pariharāmi	Mettā-pharaṇa	Universal Well-Being	Reflections							321n	anīgh	a adj	5			
anukantati	ps		pr					trans	+acc	cuts; slashes; slices; shears			√kat 2 ṃa (to cut)	√kat + ṃa > kanta	anu + kanta + ti	anukṛṃtati	√kṛt				DHP 311	nirayavaggo	kuso yathā duggahito, hattham'eva-<b>anukantati</b>,<br/>sāmaññaṃ dupparāmaṭṭhaṃ, nirayāy'upakaḍḍhati.				SN 2.8	tāyanasuttaṃ	kuso yathā duggahito, hattham’ev’<b>ānukantati</b>, <br/>sāmaññaṃ dupparāmaṭṭhaṃ, nirayāy’upakaḍḍhati.	Tāyana-gāthā	On Protection	Verses							14n	anukant	ati pr	5			
anukampaka	s		adj		anukampā				+dat	compassionate (towards); kind (to)			√kamp 1 a (to shake, tremble)		anu + √kamp + aka	anukampaka	√kamp										MN 19	dvedhāvitakkasuttaṃ	yaṃ, bhikkhave, satthārā karaṇīyaṃ sāvakānaṃ hit’esinā <b>anukampakena</b> anukampaṃ upādāya, kataṃ vo taṃ mayā.	Pakiṇṇaka-gāthā	Miscellaneous Verses	Verses							15n	anukamp	aka adj	5			
anukampamānasa	s		adj	comp						having compassion (for); taking pity (on); having concern (for); lit. with compassionate mind					anukampa + mānasa												Thai		sādhu no bhante bhagavā suciraparinibbuto’pi pacchimājanata-<b>anukampamānasā</b>	Buddh'ādi-āmisa-pūjā	Dedication of Offerings	Homage to the Triple Gem							01n	anukampamānas	a adj	5			
anukampaṃ upādāya	ps		idiom	fem + ger						out of compassion; lit. taking pity									(SNa) anukampaṃ upādāyā'ti anukampaṃ cittena pariggahetvā, paṭiccā'ti'pi vuttaṃ hoti.		AN 10.60	girimānandasuttaṃ	sādhu, bhante, bhagavā yen'āyasmā girimānando ten'upasaṅkamatu <b>anukampaṃ</b> <b>upādāyā</b>”ti.				MN 19	dvedhāvitakkasuttaṃ	yaṃ, bhikkhave, satthārā karaṇīyaṃ sāvakānaṃ hit’esinā anukampakena <b>anukampaṃ</b> <b>upādāya</b>, kataṃ vo taṃ mayā.	Pakiṇṇaka-gāthā	Miscellaneous Verses	Verses							15n	!	anukampa upādāya	5			
anukampā	ss		fem		anukampati				+loc	compassion; pity; lit. trembling with			√kamp 1 a (to shake, tremble)		anu + √kamp + ā	anukampā	√kamp										MN 19	dvedhāvitakkasuttaṃ	yaṃ, bhikkhave, satthārā karaṇīyaṃ sāvakānaṃ hit’esinā anukampakena <b>anukampaṃ</b> upādāya, kataṃ vo taṃ mayā.	Pakiṇṇaka-gāthā	Miscellaneous Verses	Verses	Thai		sādhu no bhante bhagavā suciraparinibbuto’pi pacchimājanata-<b>anukampa</b>-mānasā	Buddh'ādi-āmisa-pūjā	Dedication of Offerings	Homage to the Triple Gem	15n	anukamp	ā fem	5	7	128	
anukampī	ps		adj		anukampati					compassionate; lit. shake together			√kamp 1 a (to shake, tremble)		anu + √kamp + ī	anukampin	√kṛp				AN 8.1	mettāsuttaṃ	ekam’pi ce pāṇam’aduṭṭhacitto, mettāyati kusalī tena hoti. <br/>sabbe ca pāṇe manas’<b>ānukampī</b>, pahūtam’ariyo pakaroti puññaṃ.				MN 107	gaṇakamoggallānasuttaṃ	byāpādapadosaṃ pahāya abyāpannacitto viharati sabbapāṇabhūtahit’<b>ānukampī, </b>byāpādapadosā cittaṃ parisodheti	Anupubba-sikkhā	The Gradual Training	Teachings							18n	anukamp	ī adj	5			
anukkhitta	ps		pp		na ukkhipati	neg				(vinaya) not suspended			√khip 1 a (to throw)		na + ud + √khip + ta	utkṣipta	√kṣip				VIN PAT PK	saṅghuposatha pubbakaraṇādi vidhi	yattakā bhikkhū tassa uposathakammassa patta-yuttā anurūpā, sabb’antimena paricchedena cattāro bhikkhū pakatattā, saṅghena <b>anukkhittā</b>, te ca kho hatthapāsaṃ avijahitvā ekasīmayaṃ ṭhitā.				PAT PK	dhammayuttika-pubbakicca	yāvatikā ca bhikkhū kammappattā saṅgh'uposath'ārahā cattāro vā tato vā atirekā pakatattā pārājikaṃ anāpannā saṅghena vā <b>anukkhittā</b>.	Pubbakicca	Preliminary duty	International Pātimokkha							80n	anukkhitt	a pp	5			
anuga	s		adj							following; followed by; going after			√gam 1 a (to go)		anu + √gam + a	anuga	√gam										SNP 22	uṭṭhānasuttaṃ<br/> cūḷavaggo 10	uṭṭhahatha nisīdatha, daḷhaṃ sikkhatha santiyā, <br/>mā vo pamatte viññāya, maccurājā amohayittha vas’<b>ānuge.</b>	Pakiṇṇaka-gāthā	Miscellaneous Verses	Verses							15n	anug	a adj	5			
anuggaha	ps		nt		anuggaṇhāti					support; help; assistance; nurturing			√gah 6 ṇhā (to grasp, take)		anu + √gah + a	anugraha	√grah √gṛbh √gṛh				SN 12.63	puttamaṃsūpamasuttaṃ	cattāro’me āhārā bhūtānaṃ vā sattānaṃ ṭhitiyā sambhav’esīnaṃ vā <b>anuggahāya</b> : kabaḷīkāro āhāro oḷāriko vā sukhumo vā, phasso dutiyo, mano-sañcetanā tatiyā, viññāṇaṃ catutthaṃ				MN 2.4	sabbāsavasuttaṃ	paṭisaṅkhā yoniso piṇḍapātaṃ paṭisevāmi n’eva davāya na madāya na maṇḍanāya na vibhūsanāya yāva’d’eva imassa kāyassa ṭhitiyā yāpanāya vihiṃsūparatiyā brahmacariy’<b>ānuggahāya</b> 	Cattaro parikkhāra	The Four Requisites	Reflections							30n	anuggah	a nt	5			
anuttara	pss	2	adj	compar	na ud	neg			+gen	highest; unsurpassed; unexcelled; superior; lit. nothing higher					na + ud + tara	anuttara					MN 10.10	mahāsatipaṭṭhānasuttaṃ	sauttaraṃ vā cittaṃ ‘sauttaraṃ cittan’ti pajānāti, <b>anuttaraṃ</b> vā cittaṃ ‘anuttaraṃ cittan’ti pajānāti; 				SNP 13	ratanasuttaṃ<br/>cūḷavaggo 1	varo vara’ññū vara’do var’āharo,  <br/><b>anuttaro</b> dhamma-varaṃ adesayi.	Ratana-sutta		Protective Recitations	SN 11.3	dhajaggasuttaṃ	iti’pi so bhagavā arahaṃ sammāsambuddho vijjācaraṇasampanno sugato lokavidū <b>anuttaro</b> purisadammasārathi satthā devamanussānaṃ buddho bhagavā'ti	Buddha-dhamma-saṅgha-guṇā		Protective Recitations	52n	anuttar	a adj	5	11	743	[sound:anuttara.mp3]
anuddhata 1	ps		pp		na uddharati	neg				calm; gentle; subdued; not agitated; lit. not carried up			√dhar 1 a (to hold, carry, endure)		na + ud + √dhar + ta	an + uddhata	√dhṛ			see anuddhata 2	TH 261	mahākassapattheragāthā	<b>anuddhato</b> acapalo, nipako saṃvut’indriyo, <br/>sobhati paṃsukūlena, sīho’va girigabbhare.				MN 107	gaṇakamoggallānasuttaṃ	uddhaccakukkuccaṃ pahāya <b>anuddhato</b> viharati ajjhattaṃ vūpasantacitto, uddhaccakukkuccā cittaṃ parisodheti	Anupubba-sikkhā	The Gradual Training	Teachings							18n	anuddhat	a pp	5			
anudhammacārī	ps		adj	comp					+gen	living according to the Dhamma; following the Dhamma; practising according to the Dhamma					anudhamma + cārī	anu + dharmacārin					DHP 020	yamakavaggo	appam'pi ce sahitaṃ bhāsamāno, dhammassa hoti <b>anudhammacārī</b>,<br/>rāgañ'ca dosañ'ca pahāya mohaṃ, sammappajāno suvimuttacitto,<br/>anupādiyāno idha vā huraṃ vā, sa bhāgavā sāmaññassa hoti.				DN 16.27	mahāparinibbānasuttaṃ	yo kho bhikkhu vā bhikkhunī vā upāsako vā upāsikā vā dhamm’ānudhamma-ppaṭipanno viharati sāmīcippaṭipanno <b>anudhammacārī</b>, 	Paramāya pūjāyañca paṇidhiñca	The Highest Honour and Aspirations	Sharing of Merits							72n	anudhammacār	ī adj	5			
anudhamma 1	ps		adj		dhamma					according to; in line with			√dhar 1 a (to hold, carry, endure)		anu + √dhar + ma	anu + dharma	√dhṛ				MN 105	sunakkhattasuttaṃ	lok'āmis'ādhimuttassa kho, sunakkhatta, purisapuggalassa tappatirūpī c'eva kathā saṇṭhāti, tad'<b>anudhammañ</b>'ca anuvitakketi, anuvicāreti, tañ'ca purisaṃ bhajati, tena ca vittiṃ āpajjati				DN 16.27	mahāparinibbānasuttaṃ	yo kho bhikkhu vā bhikkhunī vā upāsako vā upāsikā vā dhamm’<b>ānudhamma</b>-ppaṭipanno viharati sāmīcippaṭipanno anudhammacārī, 	Paramāya pūjāyañca paṇidhiñca	The Highest Honour and Aspirations	Sharing of Merits							72n	anudhamm	a adj	5			
anudhamma 2	s		adj		dhamma					according to Dhamma; in line with Dhamma			√dhar 1 a (to hold, carry, endure)		anu + √dhar + ma	anu + dharma	√dhṛ										DN 16.27	mahāparinibbānasuttaṃ	yo kho bhikkhu vā bhikkhunī vā upāsako vā upāsikā vā dhamm’ānudhamma-ppaṭipanno viharati sāmīcippaṭipanno <b>anudhamma</b>-cārī, 	Paramāya pūjāyañca paṇidhiñca	The Highest Honour and Aspirations	Sharing of Merits							72n	anudhamm	a adj	5			
anudhāvati 1	s		pr					trans	+acc	runs along; runs up and down; runs back and forth			√dhāv 1 a (to run, flow)	√dhāv + a > dhāva	anu + dhāva + ti	anudhāvate	√dhāv										DHP 085	paṇḍitavaggo	appakā te manussesu, ye janā pāragāmino.<br/>ath’āyaṃ itarā pajā, tīram’ev’<b>ānudhāvati.</b>	Ti-lakkhaṇā	The Three Characteristics	Verses							10n	anudhāv	ati pr	5			
anupagamma	s		ger		na upagacchati	neg		trans	+acc	avoiding; not going near; lit. not approaching			√gam 1 a (to go)		na + upa + √gam + ya	an + upagamya	√gam										SN 56.11	dhammacakkappavattanasuttaṃ	ete kho, bhikkhave, ubho ante <b>anupagamma</b> majjhimā paṭipadā tathāgatena abhisambuddhā cakkhukaraṇī ñāṇakaraṇī upasamāya abhiññāya sambodhāya nibbānāya saṃvattati	Dhamma-cakkappavattana	Setting in Motion The Wheel of Dhamma	Teachings							17n	-		5			
anupaggamma	s		ger		na upagacchati	neg		trans	+acc	avoiding; not going near; lit. not approaching			√gam 1 a (to go)		na + upa + √gam + ya	an + upagamya	√gam										SNP 8	mettasuttaṃ<br/>uragavaggo 8	diṭṭhiñ’ca <b>anupaggamma</b>,   sīlavā dassanena sampanno,  <br/>kāmesu vineyya gedhaṃ,   na hi jātu gabbha-seyyaṃ punar’etī’ti.	Karaṇīya-metta-sutta	The Buddha’s Words on Loving-Kindness	Protective Recitations							53n	-		5			
anupatita	ps		pp		anupatati				+instr	fallen (into); afflicted (with); stricken (by); lit. fallen along (with)			√pat 1 a (to fall)		anu + √pat + ita	anupatita	√pat				DHP 302	pakiṇṇakavaggo	duppabbajjaṃ durabhiramaṃ, durāvāsā gharā dukhā,<br/>dukkh'osamāna-saṃvāso, dukkh'ānupatit'addhagū,<br/>tasmā na c'addhagū siyā, na ca dukkh'<b>ānupatito</b> siyā.				SNP 22	uṭṭhānasuttaṃ<br/> cūḷavaggo 10	pamādo rajo pamādo, pamād’<b>ānupatito</b> rajo, <br/>appamādena vijjāya, abbahe sallam’attano’ti.	Pakiṇṇaka-gāthā	Miscellaneous Verses	Verses							15n	anupatit	a pp	5			
anupabbajjā	s		fem	abstr	anupabbajati				+gen	following into the monastic life; going forth (to holy life) after			√vaj 1 a (to go on)		anu + pa + √vaj > baj + yā	anupravrajana (bsk)	√vraj										SN 46.3 (simpl)	sīlasuttaṃ	savanam’p’āhaṃ, upasaṅkamanam’p’āhaṃ, payirupāsanam’p’āhaṃ, anussatim’p’āhaṃ, <b>anupabbajjam</b>’p’āhaṃ	Satta-sambojjhaṅgā	The Seven Factors of Awakening	Teachings							20n	anupabbajj	ā fem	5			
anupassī 1	s	5	adj	in comps	anupassati				+acc	looking (at); observing; following; noticing; witnessing; watching			√dis 1 a (to see)	√dis + a > passa (irreg)	anu + passa + ī	anupaśya	√dṛś				DHP 253	malavaggo	paravajja-<b>anupassissa</b>, niccaṃ ujjhānasaññino,<br/>āsavā tassa vaḍḍhanti, ārā so āsavakkhayā.				DN 22.18	mahāsatipaṭṭhānasuttaṃ	idha, bhikkhave, bhikkhu kāye kāy’<b>ānupassī</b> viharati ātāpī sampajāno satimā, vineyya loke abhijjhā-domanassaṃ	Ariy’aṭṭhaṅgika-magga	The Noble Eightfold Path	Teachings	MN 118	ānāpānassatisuttaṃ	anicca-<b>anupassī</b> assasissāmī’ti sikkhati, anicca-<b>anupassī</b> passasissāmī’ti sikkhati	Ānāpānassati	Mindfulness of Breathing	Teachings	22n	anupass	ī adj	5			[sound:anupassī.mp3]
anupassī 2	ps		masc	agent, in comps	anupassati				+acc	observer (of); witness (of); watcher (of); follower (of); lit. follow-see-er; seeing again and again			√dis 1 a (to see)	√dis + a > passa (irreg)	anu + passa + ī	anupaśya	√dṛś				DHP 253	malavaggo	paravajja-<b>anupassissa</b>, niccaṃ ujjhānasaññino,<br/>āsavā tassa vaḍḍhanti, ārā so āsavakkhayā.				DN 22.18	mahāsatipaṭṭhānasuttaṃ	idha, bhikkhave, bhikkhu kāye kāy’<b>ānupassī</b> viharati ātāpī sampajāno satimā, vineyya loke abhijjhā-domanassaṃ	Ariy’aṭṭhaṅgika-magga	The Noble Eightfold Path	Teachings							21n	anupass	ī masc	5			[sound:anupassī.mp3]
anupādāniya	s		adj	ptp	na upādiyati	neg				which can not be grasped; which could not be clung to; which can not be used for fuel			√ādā 3 ya (to take, seize)		na + upa + √ādā + aniya	na + upādā	ā√dā										DS 1	tikamātikā	upādinn’upādāniyā dhammā. anupādinn’upādāniyā dhammā. anupādinn’<b>ānupādāniyā</b> dhammā.	Dhamma-saṅgaṇī-mātikā		Funeral Chants							63n	anupādāniy	a adj	5			
anupādāya	ps		ger		na upādiyati	neg		trans	+acc	not holding (onto); not grasping (onto); detaching (from)			√ādā 3 ya (to take, seize)		na + upa + √ādā + ya	na + upādā	ā√dā				AN 3.93	accāyikasuttaṃ	ajj'eva me <b>anupādāya</b> āsavehi cittaṃ vimuccatu sve vā uttarasve vā'ti				SN 22.59	anattalakkhaṇasuttaṃ	imasmiñ’ca pana veyyākaraṇasmiṃ bhaññamāne pañcavaggiyānaṃ bhikkhūnaṃ <b>anupādāya</b> āsavehi cittāni vimucciṃsū’ti.	Anatta-lakkhaṇa-sutta	The Discourse on the Characteristic of Not-Self	Cardinal Suttas							38n	-		5	8	177	
anupādinna	ps		pp		na upādiyati	neg				not grasped; not clung to; not attached to; not taken as 'mine'			√ādā 3 ya (to take, seize)		na + upa + √ādā > ādī + na	na + upādā	ā√dā				SN 22.85	yamakasuttaṃ	so viññāṇaṃ na upeti, na upādiyati, n'ādhiṭṭhāti, attā me'ti. tass'ime pañc'upādānakkhandhā anupetā <b>anupādinnā</b> dīgharattaṃ hitāya sukhāya saṃvattantī'ti.				DS 1	tikamātikā	upādinn’upādāniyā dhammā. <b>anupādinn</b>’upādāniyā dhammā. <b>anupādinn</b>’ānupādāniyā dhammā.	Dhamma-saṅgaṇī-mātikā		Funeral Chants							63n	anupādinn	a pp	5			
anupāhana	s		adj		na upāhana	neg				without shoes; without sandals			√nah 3 ya (to bind, to arm)		na + upa + ā + √nah > han + a	anupānah	√ṇah										TH 257	pārāpariyattheragāthā	“yathā kaṇṭaka-ṭṭhānamhi, careyya <b>anupāhano</b>.<br/>satiṃ upaṭṭhapetvāna, evaṃ gāme munī care.	Pārāpariya-thera-gāthā	From the Elder Pārāpariya	Verses							13n	anupāhan	a adj	5			
anupubba	s		adj	comp						gradual; step-by-step					anu + pubba	anupūrva											MN 107	gaṇakamoggallānasuttaṃ	sakkā nu kho, bho gotama, imasmim’pi dhammavinaye evam’eva <b>anupubba</b>-sikkhā <b>anupubba</b>-kiriyā <b>anupubba</b>-paṭipadā paññapetun’ti	Anupubba-sikkhā	The Gradual Training	Teachings							18n	anupubb	a adj	5			
anupubbakiriyā	s		fem	comp						gradual undertaking; step-by-step activity; successive process					anupubba + kiriyā												MN 107	gaṇakamoggallānasuttaṃ	sakkā nu kho, bho gotama, imasmim’pi dhammavinaye evam’eva anupubbasikkhā <b>anupubbakiriyā</b> anupubbapaṭipadā paññapetun’ti	Anupubba-sikkhā	The Gradual Training	Teachings							18n	anupubbakiriy	ā fem	5			
anupubbapaṭipadā	s		fem	comp						gradual way; method step-by-step					anupubba + paṭipadā												MN 107	gaṇakamoggallānasuttaṃ	sakkā nu kho, bho gotama, imasmim’pi dhammavinaye evam’eva anupubbasikkhā anupubbakiriyā <b>anupubbapaṭipadā</b> paññapetun’ti	Anupubba-sikkhā	The Gradual Training	Teachings							18n	anupubbapaṭipad	ā fem	5			
anupubbasikkhā	s	1	fem	comp						gradual training; practice step-by-step					anupubba + sikkhā												MN 107	gaṇakamoggallānasuttaṃ	sakkā nu kho, bho gotama, imasmim’pi dhammavinaye evam’eva <b>anupubbasikkhā</b> anupubbakiriyā anupubbapaṭipadā paññapetun’ti	Anupubba-sikkhā	The Gradual Training	Teachings							18n	anupubbasikkh	ā fem	5			
anuppadātar	s		masc	agent	anuppadāti					provider (of); giver (of); supporter (of)			√dā 1 a (to give)		anu + pa + √dā + tar	anupradātṛ	√dā										MN 51	kandarakasuttaṃ	iti bhinnānaṃ vā sandhātā sahitānaṃ vā <b>anuppadātā</b> samagg’ārāmo samaggarato samagganandī samaggakaraṇiṃ vācaṃ bhāsitā hoti	Anupubba-sikkhā	The Gradual Training	Teachings							18n	anuppadāt	ar masc	5	6	21	
anuppadinna	s		pp		anuppadāti					given; handed over			√dā 1 a (to give)		anu + pa + √dā > dī + na		√dā										KHP 7	tirokuṭṭasuttaṃ	so ñātidhammo ca ayaṃ nidassito, petāna’pūjā ca katā uḷārā. balañ’ca bhikkhūnam’<b>anuppadinnaṃ</b>, tumhehi puññaṃ pasutaṃ anappakan’ti.	Adāsi-me ādi gāthā		Funeral Chants							66n	anuppadinn	a pp	5			
anuppanna	ps		pp		na anupajjati	neg				unborn; unarisen; not yet existent			√pad 3 ya (to go, step)		na + ud + √pad + na	anutpanna	√pad				MN 2.1	sabbāsavasuttaṃ	ayoniso manasikaroto <b>anuppannā</b> c’eva āsavā uppajjanti, uppannā ca āsavā pavaḍḍhanti; yoniso ca kho, bhikkhave, manasikaroto <b>anuppannā</b> c’eva āsavā na uppajjanti, uppannā ca āsavā pahīyanti.				DN 22.18	mahāsatipaṭṭhānasuttaṃ	bhikkhu <b>anuppannānaṃ</b> pāpakānaṃ akusalānaṃ dhammānaṃ anuppādāya chandaṃ janeti vāyamati vīriyaṃ ārabhati cittaṃ paggaṇhāti padahati	Ariy’aṭṭhaṅgika-magga	The Noble Eightfold Path	Teachings							21n	anuppann	a pp	5	11	333	
anuppāda	ps		masc		na uppajjati	neg				non arising; non-appearance; not coming into existence			√pad 3 ya (to go, step)		na + ud + √pad + *a	anutpāda	√pad				MN 10.13	mahāsatipaṭṭhānasuttaṃ	yathā ca uppannassa saṃyojanassa pahānaṃ hoti tañ’ca pajānāti, yathā ca pahīnassa saṃyojanassa āyatiṃ <b>anuppādo</b> hoti tañ’ca pajānāti.				DN 22.18	mahāsatipaṭṭhānasuttaṃ	bhikkhu anuppannānaṃ pāpakānaṃ akusalānaṃ dhammānaṃ <b>anuppādāya</b> chandaṃ janeti vāyamati vīriyaṃ ārabhati cittaṃ paggaṇhāti padahati	Ariy’aṭṭhaṅgika-magga	The Noble Eightfold Path	Teachings							21n	anuppād	a masc	5			
anubodhaka	s		adj							having knowledge; with understanding; awakened			√budh 3 ya (to wake up)		anu + √budh > bodh + *aka	anubodha	√budh										Thai		saṅgho sukhett’ābhyati-khetta-saññito, yo diṭṭha-santo sugat’<b>ānubodhako</b>, lola-ppahīno ariyo sumedhaso	Ratanattaya-paṇāma	Salutation to the Triple Gem	Homage to the Triple Gem							05n	anubodhak	a adj	5			
anubyañjanaggāhī	s		adj	comp						enticed by the details; grasping the secondary characteristics					anubyañjana + gāhī	anuvyañjana + gṛhāya											MN 107	gaṇakamoggallānasuttaṃ	‘ehi tvaṃ, bhikkhu, indriyesu guttadvāro hohi, cakkhunā rūpaṃ disvā mā nimitta-ggāhī hohi mā-<b>anubyañjanaggāhī</b>.	Anupubba-sikkhā	The Gradual Training	Teachings							18n	anubyañjanaggāh	ī adj	5			
anubyañjana 1	s		nt		byañjana					secondary characteristic; detail			√añj 8 *e (to distinguish)		anu + vi + √añj + ana	anuvyañjana	√añc										MN 107	gaṇakamoggallānasuttaṃ	‘ehi tvaṃ, bhikkhu, indriyesu guttadvāro hohi, cakkhunā rūpaṃ disvā mā nimitta-ggāhī hohi m’<b>ānubyañjana</b>-ggāhī.	Anupubba-sikkhā	The Gradual Training	Teachings							18n	anubyañjan	a nt	5			
anubrūhanta	s		prp		anubrūhati			intrans		continuously increasing; spreading; cultivating; developing			√brūh 1 a (to increase)	√brūh + a > brūha	anu + brūha + nta	bṛṃhayitR	√bṛh √bṛṃh										TH 257	pārāpariyattheragāthā	araññe rukkhamūlesu, kandarāsu guhāsu ca.<br/>vivekam’<b>anubrūhantā</b>, vihaṃsu tap’parāyanā	Pārāpariya-thera-gāthā	From the Elder Pārāpariya	Verses							13n	anubrūh	anta prp	5			
anubrūhayati	ps		pr		anubrūhati		caus	trans	+acc	fosters; nurtures; develops; lit. causes to increase			√brūh 1 *aya (to increase)	√brūh + aya > brūhaya (caus)	anu + brūhaya + ti	bṛṃhayati	√bṛh √bṛṃh				DHP 075	bālavaggo	aññā hi lābh'ūpanisā, aññā nibbānagāminī,<br/>evam'etaṃ abhiññāya, bhikkhu buddhassa sāvako,<br/>sakkāraṃ n'ābhinandeyya, vivekam'<b>anubrūhaye</b>.				MN 131	bhaddekarattasuttaṃ	paccuppannañ’ca yaṃ dhammaṃ, tattha tattha vipassati. asaṃhīraṃ asaṅkuppaṃ, taṃ vidvā m-<b>anubrūhaye</b>.	Bhadd’eka-ratta	A single Excellent Night	Verses							16n	anubrūhay	ati pr	5			
anumānetabba	s		ptp		anumāneti		caus	trans		can be permitted; should be obtained the permission; to be approved			√mān 8 *e (to worship)	√mān + *e > māne	anu + māne + tabba		√mān										PAT PK	dhammayuttika-pubbakicca	uposathakammassa pattakallattaṃ viditvā idāni kariyamāno uposatho saṅghena <b>anumānetabbo</b>.	pubbakicca	Preliminary duty	International Pātimokkha							80n	anumānetabb	a ptp	5			
anumodati	ps		pr					trans	+acc	approves (of); appreciates; applauds; is pleased (by)			√mud 1 a (to be soft, happy)	√mud + *a > moda	anu + moda + ti	anumodate	√mud				AN 3.68	kathāvatthusuttaṃ	anusūyāyamāno so, samma'd'aññāya bhāsati,<br/>subhāsitaṃ <b>anumodeyya</b>, dubbhaṭṭhe n'āpasādaye.				AN 5.36	kāladānasuttaṃ	ye tattha <b>anumodanti</b>, veyyāvaccaṃ karonti vā. na tena dakkhiṇā ūnā, te’pi puññassa bhāgino.	Kāla-dāna-sutta-gāthā		Thanksgiving Recitations							45n	anumod	ati pr	5			
anumodanā	s		fem	abstr						rejoicing (in merit); thanksgiving; appreciation; blessing			√mud 1 a (to be soft, happy)		anu + √mud > mod + *anā		√mud										Thai		mayā dinnāna-puññānaṃ <b>anumodana</b>-hetunā, sabbe sattā sadā hontu averā sukha-jīvino, khemappadañ’ca pappontu tesāsā sijjhataṃ subhā	Sabba-patti-dāna		Sharing of Merits							69n	anumodan	ā fem	5			
anuyutta 2	ps		adj	pp	anuyuñjati					devoted to; applied oneself to; practised; doing			√yuj 2 ṃa (to join, yoke)		anu + √yuj + ta	anu + yukta	√yuj				TH 257	pārāpariyattheragāthā	“n’<b>ānuyuttā</b> tathā eke, muṇḍā saṅghāṭi-pārutā.<br/>sambhāvanaṃ-yev’icchanti, lābhasakkāra-mucchitā.				MN 107	gaṇakamoggallānasuttaṃ	ehi tvaṃ, bhikkhu, jāgariyaṃ <b>anuyutto</b> viharāhi, divasaṃ caṅkamena nisajjāya āvaraṇīyehi dhammehi cittaṃ parisodhehi	Anupubba-sikkhā	The Gradual Training	Teachings							18n	anuyutt	a adj	5			
anuyoga	ps		masc		anuyuñjati				+gen	practice of; devotion to; pursuit of; doing; lit. joining with			√yuj 2 ṃa (to join, yoke)		anu + √yuj > yog + *a	anuyoga	√yuj				AN 10.73	iṭṭhadhammasuttaṃ	sajjhāya-kiriyā bāhusaccassa āhāro, sussūsā paripucchā paññāya āhāro, <b>anuyogo</b> paccavekkhaṇā dhammānaṃ āhāro				MN 51	kandarakasuttaṃ	dūteyya-pahiṇagamana-<b>anuyogā</b> paṭivirato hoti, kayavikkayā paṭivirato hoti, tulākūṭa-kaṃsakūṭa-mānakūṭā paṭivirato hoti	Anupubba-sikkhā	The Gradual Training	Teachings							18n	anuyog	a masc	5	2	85	
anurakkhati	ps		pr					trans	+acc	guards; protects			√rakkh 1 a (to protect)	√rakkh + a > rakkha	anu + rakkha + ti	anurakkhaṇā	√rakṣ				DHP 327	nāgavaggo	appamādaratā hotha, sacittam'<b>anurakkhatha</b>,<br/>duggā uddharath'attānaṃ, paṅke sanno'va kuñjaro.				SNP 8	mettasuttaṃ<br/>uragavaggo 8	mātā yathā niyaṃ puttaṃ,  āyusā eka-puttam’<b>anurakkhe</b>,  <br/>evam’pi sabba-bhūtesu,  mānasam’bhāvaye aparimāṇaṃ.	Karaṇīya-metta-sutta	The Buddha’s Words on Loving-Kindness	Protective Recitations							53n	anurakkh	ati pr	5			
anusāsanī	s	5	fem	act	anusāsati					advice; instruction; teaching			√sās 1 a (to teach, instruct)		anu + √sās + anī	anuśāsti	√śās																MN 19	dvedhāvitakkasuttaṃ	etāni, bhikkhave, rukkhamūlāni, etāni suññāgārāni. jhāyatha, bhikkhave, mā pamād’attha, mā pacchā vippaṭisārino ahuvattha. ayaṃ vo amhākaṃ <b>anusāsanī</b>’ti.	Pakiṇṇaka-gāthā	Miscellaneous Verses	Verses	15n	anusāsan	ī fem	5	8	88	[sound:anusāsanī.mp3]
anussati	ps		fem	abstr	anussarati					memory (of); recollection (of)			√sar 1 a (to remember)		anu + √sar + ti	anusmṛti	√smṛ				MN 39	mahāassapurasuttaṃ	so evaṃ samāhite citte parisuddhe pariyodāte anaṅgaṇe vigat’ūpakkilese mudubhūte kammaniye ṭhite āneñjappatte pubbenivās’<b>ānussati</b>-ñāṇāya cittaṃ abhininnāmeti.				SN 46.3 (simpl)	sīlasuttaṃ	savanam’p’āhaṃ, upasaṅkamanam’p’āhaṃ, payirupāsanam’p’āhaṃ, <b>anussatim</b>’p’āhaṃ, anupabbajjam’p’āhaṃ	Satta-sambojjhaṅgā	The Seven Factors of Awakening	Teachings							20n	anussat	i fem	5			
